{
  "$schema": "http://json-schema.org/draft-07/schema#",
  "$id": "https://glosa.example/schema/problem_card.schema.json",
  "title": "glosa problem card",
  "description": "tier: Dr (specified; independently unreviewed). Implements FOUNDATION_v0.5.md §2.2 stage S1 (Problem intake, ปัญหา): the two-question intake gate (issue as a retained difference; the human's own proposal, 'none' a legal, never-inferred answer) plus standpoint declaration, before any analysis starts. This is the `intake.schema.json` REPO_SPEC_v0.5.md names as 'S1's problem_card.schema.json, one object, one name' -- filed here under its problem_card name per this task's own naming. Exit gate is a self-check readiness verdict (READY_FOR_S2), not a release gate -- contrast with schema/readiness_report.schema.json, which is the general pre-work project-readiness self-check. Namespace https://glosa.example/ is a placeholder.",
  "type": "object",
  "required": ["problem_id", "project", "intake", "standpoint", "origin_blackbox_ref", "produced_by", "responsible", "readiness", "human_owner"],
  "additionalProperties": true,
  "$comment": "TODO(schema.pre-exposure-anchor-fields): design/SESSION_ARCH_v0.4_SPEC.md §9.2 / §3 SA-3 (status: with_revision, NOT built this pass) -- three new required Problem Card `intake` fields (`problem_stated_before_first_ai_response`, `prior_model_or_guess`, `verification_intent`) are pending a citation fix (EPISTEMIC_FUSION_v7.1.txt:354 -> :353) and either the timestamp cross-check script the proposal's own acceptance_test requires, or a narrowed schema-required-fields-only acceptance_test; retroactive-vs-forward-only applicability is also a pending founder decision (§7 item 4).",
  "properties": {
    "problem_id": { "type": "string", "pattern": "^GLOSA-PC-[0-9]{8}-[0-9]{4}$" },
    "project": { "type": "string", "minLength": 1 },
    "intake": {
      "type": "object",
      "required": ["q1_issue", "q2_user_proposal"],
      "description": "The two-question intake gate: Q1 states the issue as a retained difference (not a bare label); Q2 is the human's own proposal or explicitly 'none' -- an AI session may never infer Q2's answer on the human's behalf (§2.2 co-production split).",
      "properties": {
        "q1_issue": {
          "type": "object",
          "required": ["text_verbatim", "retained_difference_statement"],
          "properties": {
            "text_verbatim": { "type": "string", "minLength": 1 },
            "retained_difference_statement": {
              "description": "The issue restated as: a difference that survives under a declared agency/context/query -- not merely a name for a topic.",
              "type": "string", "minLength": 1
            },
            "agency": { "type": "string" },
            "context": { "type": "string" },
            "query": { "type": "string" },
            "blackbox_line_ref": { "type": "string" }
          }
        },
        "q2_user_proposal": {
          "type": "object",
          "required": ["text", "stated_by"],
          "properties": {
            "text": {
              "description": "'none' is a legal, honest value -- never silently filled in by an AI session on the human's behalf.",
              "type": "string"
            },
            "stated_by": { "$ref": "common.defs.json#/definitions/role_or_human" },
            "blackbox_line_ref": { "type": "string" }
          }
        },
        "precommitted_resistance_route": {
          "description": "SESSION_ARCH_v0.4_SPEC.md §2.1/§2.2 (schema.entry-resistance-precommit-field, build_now), the R* term of ENTRY_H->AI = H_0 ^ V_0 ^ C_0 ^ R* (sources/notes/EPISTEMIC_FUSION_v7.1.txt:356). A concrete route (source/record/experiment/critic/authority) precommitted before the first AI-turn line in the linked Blackbox Note. Additive/optional; null/absent triggers the D-NO-PRECOMMIT-ROUTE flag (kernel-only, never a hard block) once readiness.verdict reaches READY_FOR_S2. Target corrected from §2.1a (which explicitly disclaims reopening S1-S6 ownership) to this intake object, per §2.2.",
          "type": ["string", "null"]
        }
      }
    },
    "standpoint": {
      "type": "object",
      "required": ["declared_basis"],
      "properties": {
        "declared_basis": { "type": "string", "minLength": 1 },
        "disciplines_not_claimed": { "type": "array", "items": { "type": "string" } },
        "method_basis": { "type": "string" }
      }
    },
    "origin_blackbox_ref": { "type": ["string", "null"] },
    "produced_by": { "$ref": "common.defs.json#/definitions/produced_by" },
    "responsible": { "const": "human" },
    "readiness": {
      "type": "object",
      "required": ["verdict"],
      "description": "Self-check verdict only -- explicitly NOT a release gate (§2.2 S1 exit-gate column).",
      "properties": {
        "verdict": { "enum": ["READY_FOR_S2", "NOT_READY"] },
        "reason": { "type": "string" },
        "checked_by": { "$ref": "common.defs.json#/definitions/role_or_human" },
        "checked_at": { "type": "string" }
      }
    },
    "k_state": { "const": "K0" },
    "status": { "$ref": "common.defs.json#/definitions/release_status" },
    "human_owner": { "type": "string", "minLength": 1 },
    "notes": { "type": "string" }
  },
  "allOf": [
    {
      "description": "READY_FOR_S2 requires the reason for readiness to actually be stated (an honest self-check names why, not just a bare verdict).",
      "if": { "properties": { "readiness": { "type": "object", "properties": { "verdict": { "const": "READY_FOR_S2" } } } } },
      "then": { "properties": { "readiness": { "type": "object", "required": ["reason"], "properties": { "reason": { "type": "string", "minLength": 1 } } } } }
    }
  ]
}
